{
  "$schema": "https://json-schema.org/draft/2020-12/schema",
  "$id": "https://local.invalid/gate4/private_workspace_manifest.schema.json",
  "title": "Gate 4 Private Workspace Manifest",
  "type": "object",
  "additionalProperties": false,
  "required": [
    "schema_version",
    "document_type",
    "data_classification",
    "workspace_id",
    "as_of_date",
    "input_mode",
    "portfolio_nav",
    "base_currency",
    "weight_reconciliation_tolerance",
    "field_governance",
    "files"
  ],
  "properties": {
    "schema_version": {"const": "2.2.0"},
    "document_type": {"const": "gate4_private_workspace_manifest"},
    "data_classification": {
      "enum": ["PRIVATE_PORTFOLIO", "SYNTHETIC_PUBLIC_EXAMPLE"]
    },
    "workspace_id": {
      "type": "string",
      "minLength": 3,
      "maxLength": 128
    },
    "as_of_date": {
      "type": "string",
      "format": "date"
    },
    "input_mode": {
      "enum": ["EXPOSURE_ONLY", "AGGREGATED_PORTFOLIO", "FULL_HOLDINGS"]
    },
    "portfolio_nav": {
      "type": ["number", "null"],
      "exclusiveMinimum": 0
    },
    "base_currency": {
      "type": "string",
      "pattern": "^[A-Z]{3}$"
    },
    "weight_reconciliation_tolerance": {
      "type": "number",
      "minimum": 0,
      "maximum": 0.05
    },
    "field_governance": {
      "type": "object",
      "additionalProperties": false,
      "required": [
        "contract_version",
        "reviewer_confirmed_not_applicable"
      ],
      "properties": {
        "contract_version": {"const": "1.2.0"},
        "reviewer_confirmed_not_applicable": {
          "type": "array",
          "items": {
            "type": "object",
            "additionalProperties": false,
            "required": [
              "document",
              "field_path",
              "row_id",
              "rationale",
              "reviewed_by",
              "reviewed_at"
            ],
            "properties": {
              "document": {
                "enum": [
                  "manifest",
                  "policy",
                  "exposures",
                  "holdings",
                  "opportunities",
                  "constraints",
                  "approval",
                  "freshness"
                ]
              },
              "field_path": {
                "type": "string",
                "pattern": "^[A-Za-z0-9_.]+$",
                "maxLength": 256
              },
              "row_id": {"type": ["string", "null"], "maxLength": 128},
              "rationale": {"type": "string", "minLength": 1, "maxLength": 2000},
              "reviewed_by": {"type": "string", "minLength": 2, "maxLength": 256},
              "reviewed_at": {"type": "string", "format": "date-time"}
            }
          }
        }
      }
    },
    "files": {
      "type": "object",
      "additionalProperties": false,
      "required": [
        "portfolio_policy",
        "exposure_summary",
        "current_holdings",
        "opportunity_set",
        "portfolio_constraint_inputs",
        "approval_config",
        "gate3_freshness_attestation",
        "private_output_dir"
      ],
      "properties": {
        "portfolio_policy": {"type": "string", "minLength": 1},
        "exposure_summary": {"type": ["string", "null"], "minLength": 1},
        "current_holdings": {"type": ["string", "null"], "minLength": 1},
        "opportunity_set": {"type": "string", "minLength": 1},
        "portfolio_constraint_inputs": {"type": "string", "minLength": 1},
        "approval_config": {"type": "string", "minLength": 1},
        "gate3_freshness_attestation": {"type": "string", "minLength": 1},
        "private_output_dir": {"type": "string", "minLength": 1}
      }
    }
  },
  "allOf": [
    {
      "if": {
        "properties": {"input_mode": {"const": "EXPOSURE_ONLY"}},
        "required": ["input_mode"]
      },
      "then": {
        "properties": {
          "files": {
            "properties": {
              "exposure_summary": {"type": "string"},
              "current_holdings": {"type": "null"}
            }
          }
        }
      }
    },
    {
      "if": {
        "properties": {"input_mode": {"const": "AGGREGATED_PORTFOLIO"}},
        "required": ["input_mode"]
      },
      "then": {
        "properties": {
          "portfolio_nav": {"type": "number"},
          "files": {
            "properties": {
              "exposure_summary": {"type": "string"},
              "current_holdings": {"type": "string"}
            }
          }
        }
      }
    },
    {
      "if": {
        "properties": {"input_mode": {"const": "FULL_HOLDINGS"}},
        "required": ["input_mode"]
      },
      "then": {
        "properties": {
          "portfolio_nav": {"type": "number"},
          "files": {
            "properties": {
              "current_holdings": {"type": "string"}
            }
          }
        }
      }
    }
  ]
}
